Bill_Id,Bill_Title,Bill_Type,Parliamentary_Year,Term,Standing_Committee,Sponsor_Count,Party_Diversity,Parties,Sponsors
"The Drugs (Amendment) Bill, 2023
[Support]_5_15","The Drugs (Amendment) Bill, 2023
[Support]",Private,5,15,Not Applicable,5,1,PPPP,Qadir Khan Mandokhail;Qadir Khan Mandokhail;Qadir Khan Mandokhail;Qadir Khan Mandokhail;Qadir Khan Mandokhail
"The Elections (Amendment) Bill, 2018
[Support]_1_15","The Elections (Amendment) Bill, 2018
[Support]",Government,1,15,Not Applicable,5,1,PTI,Ali Muhammad Khan;Ali Muhammad Khan;Ali Muhammad Khan;Ali Muhammad Khan;Ali Muhammad Khan
The Islamabad Capital Territory State Counsel Remu_5_15,"The Islamabad Capital Territory State Counsel Remuneration Bill, 2023
[Support]",Private,5,15,Not Applicable,5,1,PTI,Asiya Azeem;Asiya Azeem;Asiya Azeem;Asiya Azeem;Asiya Azeem
"The Board of Investment (Amendment) Bill, 2022
[Su_4_15","The Board of Investment (Amendment) Bill, 2022
[Support]",Private,4,15,Not Applicable,5,1,PTI,Uzma Riaz;Uzma Riaz;Uzma Riaz;Uzma Riaz;Uzma Riaz
The Biological and Toxin Weapons Convention (Imple_1_16,"The Biological and Toxin Weapons Convention (Implementation) Bill, 2024
[Support]",Government,1,16,Not Applicable,5,2,IND;PML-N,Mohammad Ishaq Dar;Mohammad Ishaq Dar;Mohammad Ishaq Dar;Mohammad Ishaq Dar;Mohammad Ishaq Dar
"The Constitution (Amendment) Bill, 2019 (Article 6_1_15","The Constitution (Amendment) Bill, 2019 (Article 62 and 63)
[Support]",Private,1,15,Not Applicable,5,1,PTI,Noor Alam Khan;Noor Alam Khan;Noor Alam Khan;Noor Alam Khan;Noor Alam Khan
The Fiscal Responsibility and Debt Limitation (Ame_4_15,"The Fiscal Responsibility and Debt Limitation (Amendment) Bill, 2022
[Support]",Private,4,15,Not Applicable,5,1,PTI,Uzma Riaz;Uzma Riaz;Uzma Riaz;Uzma Riaz;Uzma Riaz
The Islamabad Capital Territory Senior Citizens (A_4_15,"The Islamabad Capital Territory Senior Citizens (Amendment) Bill, 2021
[Support]",Private,4,15,Not Applicable,5,1,PTI,Faheem Khan;Faheem Khan;Faheem Khan;Faheem Khan;Faheem Khan
The Un-attended Orphans (Rehabilitation and Welfar_1_15,"The Un-attended Orphans (Rehabilitation and Welfare) Bill, 2019
[Support]",Private,1,15,Not Applicable,5,1,PPPP,Dr. Shazia Sobia;Dr. Shazia Sobia;Dr. Shazia Sobia;Dr. Shazia Sobia;Dr. Shazia Sobia
"The Maternity and Paternity Leave Bill, 2020
[Supp_2_15","The Maternity and Paternity Leave Bill, 2020
[Support]",Private,2,15,Not Applicable,5,1,PPPP,Shazia Marri;Shazia Marri;Shazia Marri;Shazia Marri;Shazia Marri
"The Constitution (Amendment) Bill, 2020 (Article 8_2_15","The Constitution (Amendment) Bill, 2020 (Article 89)
[Support]",Private,2,15,Not Applicable,5,1,PML-N,Syed Iftikhar Ul Hassan;Rana Mubashir lqbal;Sardar Muhammad Irfan Dogar;Mohsin Shah Nawaz Ranjha;Shaza Fatima Khawaja
"The Constitution (Amendment) Bill, 2024 (Article-1_1_16","The Constitution (Amendment) Bill, 2024 (Article-140A)
[Support]",Private,1,16,Not Applicable,5,1,MQM,Muhammad Javed Hanif Khan;Syed Mustafa Kamal;Dr. Muhammad Farooq Sattar;Syed Hafeezuddin;Syed Amin-ul-Haque
"The Employment of Children (Amendment) Bill, 2016
_3_14","The Employment of Children (Amendment) Bill, 2016
[Support]",Private,3,14,Not Applicable,5,1,JUI,Muhammad Gohar Shah;Muhammad Jamal Ud Din;Agha Muhammad;Shahida Akhtar Ali;Mrs. Aliya Kamran
"The National Highways Safety (Amendment) Bill, 202_4_15","The National Highways Safety (Amendment) Bill, 2021
[Support]",Government,4,15,Not Applicable,5,1,MMA,Asad Mehmood;Asad Mehmood;Asad Mehmood;Asad Mehmood;Asad Mehmood
"The West Pakistan Pure Food (Amendment) Bill, 2021_3_15","The West Pakistan Pure Food (Amendment) Bill, 2021
[Support]",Private,3,15,Not Applicable,5,1,PTI,Nusrat Wahid;Nusrat Wahid;Nusrat Wahid;Nusrat Wahid;Nusrat Wahid
The Women in Distress and Detention Fund (Amendmen_5_14,"The Women in Distress and Detention Fund (Amendment) Bill, 2017
[Support]",Government,5,14,Not Applicable,4,1,PML-N,Mumtaz Ahmad Tarar;Mumtaz Ahmad Tarar;Mumtaz Ahmad Tarar;Mumtaz Ahmad Tarar
the Transplantation of Human Organs and Tissues (A_1_15,"the Transplantation of Human Organs and Tissues (Amendment) Bill, 2019
[Support]",Private,1,15,Not Applicable,4,1,MQM,Salah-ud-Din;Iqbal Muhammad Ali Khan;Kishwer Zehra;Usama Qadri
The Islamabad Capital Territory Child Marriage Res_1_16,"The Islamabad Capital Territory Child Marriage Restraint Bill, 2024
[Support]",Private,1,16,Not Applicable,4,1,PPPP,Sharmila Sahiba Faruqui Hashaam;Sharmila Sahiba Faruqui Hashaam;Sharmila Sahiba Faruqui Hashaam;Sharmila Sahiba Faruqui Hashaam
The Islamabad (Preservation of Landscape) (Amendme_4_15,"The Islamabad (Preservation of Landscape) (Amendment) Bill, 2022
[Support]",Private,4,15,Not Applicable,4,1,PPPP,Mrs. Shahida Rehmani;Mrs. Shahida Rehmani;Mrs. Shahida Rehmani;Mrs. Shahida Rehmani
"The Poisons (Amendment) Bill, 2016
[Support]_4_14","The Poisons (Amendment) Bill, 2016
[Support]",Private,4,14,Not Applicable,4,1,MQM,Muhammad Muzammil Qureshi;Kishwer Zehra;Saman Sultana Jafri;Dr. Nikhat Shakeel Khan
"The Poisons (Amendment) Bill, 2017
[Support]_4_14","The Poisons (Amendment) Bill, 2017
[Support]",Private,4,14,Not Applicable,4,1,MQM,Muhammad Muzammil Qureshi;Kishwer Zehra;Saman Sultana Jafri;Dr. Nikhat Shakeel Khan
"The Emigration (Amendment) Bill, 2018
[Support]_1_15","The Emigration (Amendment) Bill, 2018
[Support]",Private,1,15,Not Applicable,4,1,PTI,Nafeesa Inayatullah Khan Khattak;Nafeesa Inayatullah Khan Khattak;Nafeesa Inayatullah Khan Khattak;Nafeesa Inayatullah Khan Khattak
"The Emigration (Amendment) Bill, 2019
[Support]_1_15","The Emigration (Amendment) Bill, 2019
[Support]",Private,1,15,Not Applicable,4,1,PTI,Nafeesa Inayatullah Khan Khattak;Nafeesa Inayatullah Khan Khattak;Nafeesa Inayatullah Khan Khattak;Nafeesa Inayatullah Khan Khattak
"The Emigration (Amendment) Bill, 2022
[Support]_5_15","The Emigration (Amendment) Bill, 2022
[Support]",Government,5,15,Not Applicable,4,1,PPPP,Sajid Hussain Turi;Sajid Hussain Turi;Sajid Hussain Turi;Sajid Hussain Turi
The Islamabad Capital Territory Child Protection (_4_15,"The Islamabad Capital Territory Child Protection (Amendment) Bill, 2020
[Support]",Private,4,15,Not Applicable,4,1,PTI,Nafeesa Inayatullah Khan Khattak;Nafeesa Inayatullah Khan Khattak;Nafeesa Inayatullah Khan Khattak;Nafeesa Inayatullah Khan Khattak
The West Pakistan Prohibition of Smoking in Cinema_1_15,"The West Pakistan Prohibition of Smoking in Cinema Houses (Repeal) Bill, 2018
[Support]",Government,1,15,Not Applicable,4,1,PTI,Aamer Mehmood Kiyani;Aamer Mehmood Kiyani;Aamer Mehmood Kiyani;Aamer Mehmood Kiyani
The Whistleblower Protection and Vigilance Commiss_4_15,"The Whistleblower Protection and Vigilance Commission Bill, 2021
[Support]",Government,4,15,Not Applicable,4,1,MQM,Muhammad Farogh Nasim;Muhammad Farogh Nasim;Muhammad Farogh Nasim;Muhammad Farogh Nasim
"The National Metrology Institute of Pakistan Bill,_3_15","The National Metrology Institute of Pakistan Bill, 2021
[Support]",Government,3,15,Not Applicable,4,1,PTI,Fawad Ahmed;Fawad Ahmed;Fawad Ahmed;Fawad Ahmed
"The Elections (Amendment) Bill, 2021
[Support]_4_15","The Elections (Amendment) Bill, 2021
[Support]",Private,4,15,Not Applicable,4,2,PML-N;PTI,Rana Iradat Sharif Khan;Uzma Riaz;Rana Iradat Sharif Khan;Uzma Riaz
"The Constitution (Amendment) Bill, 2023 (Amendment_5_15","The Constitution (Amendment) Bill, 2023 (Amendment in Article- 51, 59 and 106)
[Support]",Private,5,15,Not Applicable,4,1,PML-N,Noor Ul Hassan Tanvir;Noor Ul Hassan Tanvir;Noor Ul Hassan Tanvir;Noor Ul Hassan Tanvir
"The Constitution (Amendment) Bill, 2024 (Amendment_1_16","The Constitution (Amendment) Bill, 2024 (Amendment in Article-51, 59 and 106)
[Support]",Private,1,16,Not Applicable,4,1,JUIP,Noor Alam Khan;Noor Alam Khan;Noor Alam Khan;Noor Alam Khan
The Legal Practitioners and Bar Councils (Amendmen_2_15,"The Legal Practitioners and Bar Councils (Amendment) Bill, 2020
[Support]",Private,2,15,Not Applicable,4,2,PPPP;PTI,Amjid Ali Khan;Ms. Nafisa Shah;Ms. Nafisa Shah;Ms. Nafisa Shah
"The Constitution (Amendment) Bill, 2020 (Article-5_3_15","The Constitution (Amendment) Bill, 2020 (Article-59)
[Support]",Private,3,15,Not Applicable,4,1,IND,Mohsin Javed;Mohsin Javed;Mohsin Javed;Mohsin Javed
"The Trafficking in Persons Bill, 2017
[Support]_5_14","The Trafficking in Persons Bill, 2017
[Support]",Private,5,14,Not Applicable,4,1,PML-N,Babar Nawaz Khan;Babar Nawaz Khan;Babar Nawaz Khan;Babar Nawaz Khan
"The Elections Bill, 2017
[Support]_5_14","The Elections Bill, 2017
[Support]",Government,5,14,Not Applicable,4,1,PML-N,Zahid Hamid Khan;Zahid Hamid Khan;Zahid Hamid Khan;Zahid Hamid Khan
The National Database and Registration Authority (_1_14,"The National Database and Registration Authority (Amendment) Bill, 2014 (Amendment in sections 8, 10, 11 and 12)
[Support]",Private,1,14,Interior and Narcotics Control,4,1,MQM,S. A. Iqbal Qadri;Abdul Waseem;Sufyan Yousuf;Dr. Nikhat Shakeel Khan
The National Database and Registration Authority (_4_14,"The National Database and Registration Authority (Amendment) Bill, 2016
[Support]",Private,4,14,Not Applicable,4,1,IND,Jamshaid Ahmad Dasti;Jamshaid Ahmad Dasti;Jamshaid Ahmad Dasti;Jamshaid Ahmad Dasti
The National Database and Registration Authority (_5_14,"The National Database and Registration Authority (Amendment) Bill, 2017 (Insertion of new Section 10-A, Ordinance VII of 2000)
[Support]",Private,5,14,Not Applicable,4,1,JI,Sher Akbar Khan;Sahibzada Tariq Ullah;Sahib Zada Muhammad Yaqub;Aisha Syed
The Loans for Agricultural Commercial and Industri_3_15,"The Loans for Agricultural Commercial and Industrial Purposes (Amendment) Bill, 2019
[Support]",Government,3,15,Not Applicable,4,2,Minister;PTI,Dr. Abdul Hafeez Sheikh;Muhammad Hammad Azhar;Muhammad Hammad Azhar;Shaukat Fayaz Ahmed Tarin
"The Constitution (Amendment) Bill, 2020 (Amendment_3_15","The Constitution (Amendment) Bill, 2020 (Amendment in Article-66)
[Support]",Private,3,15,Not Applicable,4,1,PML-N,Syed Javed Hassnain;Syed Javed Hassnain;Syed Javed Hassnain;Syed Javed Hassnain
"The Constitution (Amendment) Bill, 2020 (Amendment_2_15","The Constitution (Amendment) Bill, 2020 (Amendment in Article-84)
[Support]",Private,2,15,Not Applicable,4,1,PTI,Faiz Ullah;Faiz Ullah;Faiz Ullah;Faiz Ullah
"The Constitution (Amendment) Bill, 2020 (Amendment_3_15","The Constitution (Amendment) Bill, 2020 (Amendment in Article-84)
[Support]",Private,3,15,Not Applicable,4,1,PTI,Faiz Ullah;Faiz Ullah;Faiz Ullah;Faiz Ullah
The Foreign Exchange (Prevention of Payments) (Ame_2_15,"The Foreign Exchange (Prevention of Payments) (Amendment) Bill, 2020
[Support]",Private,2,15,Not Applicable,4,1,PTI,Riaz Fatyana;Amjid Ali Khan;Riaz Fatyana;Amjid Ali Khan
The Medical Consultancy and Other Services (Ration_4_14,"The Medical Consultancy and Other Services (Rationalization of Fees) Bill, 2016
[Support]",Private,4,14,Not Applicable,4,1,MQM,Sufyan Yousuf;Muhammad Muzammil Qureshi;Kishwer Zehra;Dr. Nikhat Shakeel Khan
"The Constitution (Amendment) Bill, 2021 (Amendment_3_15","The Constitution (Amendment) Bill, 2021 (Amendment in Article 59)
[Support]",Private,3,15,Not Applicable,4,1,PTI,Jai Parkash;Jai Parkash;Jai Parkash;Jai Parkash
"The Constitution (Amendment) Bill, 2023 (Amendment_5_15","The Constitution (Amendment) Bill, 2023 (Amendment in Article- 140)
[Support]",Private,5,15,Not Applicable,4,1,PTI,Asiya Azeem;Asiya Azeem;Asiya Azeem;Asiya Azeem
The National Institute of Cardiovascular Diseases _1_15,"The National Institute of Cardiovascular Diseases (Administration) (Amendment) Bill, 2019
[Support]",Private,1,15,Not Applicable,4,1,PTI,Riaz Fatyana;Amjid Ali Khan;Riaz Fatyana;Amjid Ali Khan
"The Elections (Second Amendment) Bill, 2024
[Suppo_1_16","The Elections (Second Amendment) Bill, 2024
[Support]",Private,1,16,Not Applicable,4,1,PML-N,Bilal Azhar Kayani;Zeb Jaffar;Bilal Azhar Kayani;Zeb Jaffar
"The Trade Organizations (Amendment) Bill, 2020
[Su_3_15","The Trade Organizations (Amendment) Bill, 2020
[Support]",Private,3,15,Not Applicable,4,1,PTI,Sajida Begum;Sajida Begum;Sajida Begum;Sajida Begum
"The Banks (Nationalization) (Amendment) Bill, 2019_1_15","The Banks (Nationalization) (Amendment) Bill, 2019
[Support]",Government,1,15,Not Applicable,4,1,Minister,Dr. Abdul Hafeez Sheikh;Dr. Abdul Hafeez Sheikh;Dr. Abdul Hafeez Sheikh;Dr. Abdul Hafeez Sheikh
The Islamabad Capital Territory Senior Citizens (A_4_15,"The Islamabad Capital Territory Senior Citizens (Amendment) Bill, 2022
[Support]",Private,4,15,Not Applicable,4,1,PTI,Faheem Khan;Faheem Khan;Faheem Khan;Faheem Khan
The Islamabad Capital Territory Senior Citizens Bi_3_15,"The Islamabad Capital Territory Senior Citizens Bill, 2020
[Support]",Government,3,15,Not Applicable,4,1,PTI,Dr. Shireen Mehrunnisa Mazari;Dr. Shireen Mehrunnisa Mazari;Dr. Shireen Mehrunnisa Mazari;Dr. Shireen Mehrunnisa Mazari
The National Database and Registration Authority (_2_14,"The National Database and Registration Authority (Amendment) Bill, 2014 (Amendment in section 10)
[Support]",Private,2,14,Not Applicable,4,1,IND,Jamshaid Ahmad Dasti;Jamshaid Ahmad Dasti;Jamshaid Ahmad Dasti;Jamshaid Ahmad Dasti
The Supreme Court (Number of Judges) (Amendment) B_5_14,"The Supreme Court (Number of Judges) (Amendment) Bill, 2017 (Amendment of Section 2, Act XXXIII of 1997)
[Support]",Private,5,14,Not Applicable,4,1,PML-N,Surriya Asghar;Surriya Asghar;Surriya Asghar;Surriya Asghar
The Education of the Holy Quran according to recit_1_14,"The Education of the Holy Quran according to recitation by sighting and withtranslation, learning by heart and with correct pronunciation Bill, 2014
[Support]",Private,1,14,Religious Affairs and Inter-faith Harmony,4,1,JI,Sher Akbar Khan;Sahibzada Tariq Ullah;Sahib Zada Muhammad Yaqub;Aisha Syed
"The Constitution (Amendment) Bill, 2019 (Articles _2_15","The Constitution (Amendment) Bill, 2019 (Articles 1, 51, 59, 106, 175A, 198 and 218)
[Support]",Private,2,15,Not Applicable,4,1,MQM,Engineer Sabir Hussain;Salah-ud-Din;Kishwer Zehra;Usama Qadri
"The Prevention of Corruption (Amendment) Bill, 201_4_14","The Prevention of Corruption (Amendment) Bill, 2016
[Support]",Private,4,14,Not Applicable,4,1,JI,Sher Akbar Khan;Sahibzada Tariq Ullah;Sahib Zada Muhammad Yaqub;Aisha Syed
"The Constitution (Amendment) Bill, 2021 (Amendment_4_15","The Constitution (Amendment) Bill, 2021 (Amendment in Article- 168)
[Support]",Private,4,15,Not Applicable,4,1,PML-N,Ali Gohar Khan;Ali Gohar Khan;Ali Gohar Khan;Ali Gohar Khan
The Pakistan Rights of Persons with Disability Bil_1_15,"The Pakistan Rights of Persons with Disability Bill, 2019
[Support]",Private,1,15,Not Applicable,4,1,PML-N,Shaista Pervaiz;Shaista Pervaiz;Shaista Pervaiz;Shaista Pervaiz
"The Constitution (Amendment) Bill, 2024 (Article-1_1_16","The Constitution (Amendment) Bill, 2024 (Article-177, 193 and 208)
[Support]",Private,1,16,Not Applicable,4,1,JUIP,Noor Alam Khan;Noor Alam Khan;Noor Alam Khan;Noor Alam Khan
The Establishment of Federal Bank for Cooperatives_5_14,"The Establishment of Federal Bank for Cooperatives and Regulation of Cooperative Banking (Repeal) Bill, 2017
[Support]",Government,5,14,Not Applicable,4,1,PML-N,Mohammad Ishaq Dar;Rana Muhammad Afzal Khan;Rana Muhammad Afzal Khan;Rana Muhammad Afzal Khan
"The Tax Laws (Third Amendment) Ordinance, 2021 (XX_4_15","The Tax Laws (Third Amendment) Ordinance, 2021 (XXII of 2021)
[Support]",Government,4,15,Not Applicable,4,1,PTI,Shaukat Fayaz Ahmed Tarin;Shaukat Fayaz Ahmed Tarin;Shaukat Fayaz Ahmed Tarin;Shaukat Fayaz Ahmed Tarin
The Benazir Income Support Programme (Amendment) B_2_15,"The Benazir Income Support Programme (Amendment) Bill, 2020
[Support]",Private,2,15,Not Applicable,4,1,PPPP,Naveed Aamir;Naveed Aamir;Naveed Aamir;Naveed Aamir
"The Births, Deaths and Marriages Registration (Ame_3_14","The Births, Deaths and Marriages Registration (Amendment) Bill, 2016
[Support]",Private,3,14,Interior and Narcotics Control,4,3,JUI;PML-N;PTI,Bhawan Das;Isphanyar M. Bhandara;Lal Chand Malhi;Aasiya Nasir
The Domestic Violence (Prevention and Protection) _3_15,"The Domestic Violence (Prevention and Protection) Bill, 2020
[Support]",Government,3,15,Not Applicable,4,1,PTI,Dr. Shireen Mehrunnisa Mazari;Dr. Shireen Mehrunnisa Mazari;Dr. Shireen Mehrunnisa Mazari;Dr. Shireen Mehrunnisa Mazari
"The Factories (Amendment) Bill, 2018
[Support]_5_14","The Factories (Amendment) Bill, 2018
[Support]",Private,5,14,Not Applicable,4,1,PML-N,Zahra Wadood Fatemi;Zahra Wadood Fatemi;Zahra Wadood Fatemi;Zahra Wadood Fatemi
"The Fatal Accidents (Amendment) Bill, 2018
[Suppor_5_14","The Fatal Accidents (Amendment) Bill, 2018
[Support]",Private,5,14,Not Applicable,4,1,IND,Malik Muhammad Aamir Dogar;Malik Muhammad Aamir Dogar;Malik Muhammad Aamir Dogar;Malik Muhammad Aamir Dogar
The National Commission on the Status of Women (Am_4_14,"The National Commission on the Status of Women (Amendment) Bill, 2016",Private,4,14,Human Rights,4,1,MQM,Shaikh Salahuddin;Muhammad Muzammil Qureshi;Saman Sultana Jafri;Dr. Nikhat Shakeel Khan
The National Commission on the Status of Women (Am_4_14,"The National Commission on the Status of Women (Amendment) Bill, 2016
[Support]",Private,4,14,Not Applicable,4,1,MQM,Shaikh Salahuddin;Muhammad Muzammil Qureshi;Saman Sultana Jafri;Dr. Nikhat Shakeel Khan
The National University of Medical Sciences (Amend_4_14,"The National University of Medical Sciences (Amendment) Bill, 2016
[Support]",Private,4,14,Not Applicable,4,1,PPPP,Dr. Azra Fazal Pecheho;Dr. Azra Fazal Pecheho;Dr. Azra Fazal Pecheho;Dr. Azra Fazal Pecheho
The Dowry and Bridal Gifts (Restriction) (Amendmen_3_14,"The Dowry and Bridal Gifts (Restriction) (Amendment) Bill, 2016
[Support]",Private,3,14,Not Applicable,4,1,MQM,Syed Ali Raza Abidi;Muhammad Muzammil Qureshi;Saman Sultana Jafri;Dr. Nikhat Shakeel Khan
The Small Business Finance Corporation (Amendment)_1_15,"The Small Business Finance Corporation (Amendment) Bill, 2019
[Support]",Private,1,15,Not Applicable,4,1,PTI,Riaz Fatyana;Amjid Ali Khan;Riaz Fatyana;Amjid Ali Khan
The Superior Courts (Code Dress and Mode of Addres_1_15,"The Superior Courts (Code Dress and Mode of Address) Order (Repeal), Bill, 2019
[Support]",Government,1,15,Not Applicable,4,1,MQM,Muhammad Farogh Nasim;Muhammad Farogh Nasim;Muhammad Farogh Nasim;Muhammad Farogh Nasim
The Right to Free and Compulsory Education (Amendm_4_15,"The Right to Free and Compulsory Education (Amendment) Bill, 2021
[Support]",Private,4,15,Not Applicable,4,1,PTI,Uzma Riaz;Uzma Riaz;Uzma Riaz;Uzma Riaz
The Right to Free and Compulsory Education (Amendm_4_15,"The Right to Free and Compulsory Education (Amendment) Bill, 2022
[Support]",Private,4,15,Not Applicable,4,1,PTI,Uzma Riaz;Uzma Riaz;Uzma Riaz;Uzma Riaz
The Pakistan National Council of the Arts (Amendme_2_15,"The Pakistan National Council of the Arts (Amendment) Bill, 2019
[Support]",Private,2,15,Not Applicable,4,1,PTI,Syed Fakhar Imam;Amjid Ali Khan;Syed Fakhar Imam;Amjid Ali Khan
The Control of Narcotics Substances (Amendment) Bi_5_15,"The Control of Narcotics Substances (Amendment) Bill, 2023
[Support]",Private,5,15,Not Applicable,4,1,PTI,Asiya Azeem;Asiya Azeem;Asiya Azeem;Asiya Azeem
The Members of Parliament Immunities and Privilege_5_15,"The Members of Parliament Immunities and Privileges Bill, 2023",Private,5,15,Not Applicable,4,1,PPPP,Khurshed Ahmed Junejo;Mir Ghulam Ali Talpur;Syed Ghulam Mustafa Shah;Ms Shagufta Jumani
The Members of Parliament Immunities and Privilege_5_15,"The Members of Parliament Immunities and Privileges Bill, 2023
[Support]",Private,5,15,Not Applicable,4,1,PPPP,Khurshed Ahmed Junejo;Mir Ghulam Ali Talpur;Syed Ghulam Mustafa Shah;Ms Shagufta Jumani
"The Microfinance Institutions (Amendment) Bill, 20_1_15","The Microfinance Institutions (Amendment) Bill, 2018
[Support]",Private,1,15,Not Applicable,4,1,PTI,Sajida Begum;Sajida Begum;Sajida Begum;Sajida Begum
"The Pakistan Penal Code (Amendment) Bill, 2023
[Su_5_15","The Pakistan Penal Code (Amendment) Bill, 2023
[Support]",Private,5,15,Not Applicable,4,1,PTI,Asiya Azeem;Asiya Azeem;Asiya Azeem;Asiya Azeem
"The Constitution (Twenty-fifth Amendment) Bill, 20_4_14","The Constitution (Twenty-fifth Amendment) Bill, 2016
[Support]",Government,4,14,Not Applicable,4,1,PML-N,Zahid Hamid Khan;Zahid Hamid Khan;Zahid Hamid Khan;Zahid Hamid Khan
The Oil and Gas Regulatory Authority (Amendment) B_3_15,"The Oil and Gas Regulatory Authority (Amendment) Bill, 2020
[Support]",Private,3,15,Not Applicable,4,1,PML-N,Kesoo Mal Kheeal Das;Kesoo Mal Kheeal Das;Kesoo Mal Kheeal Das;Kesoo Mal Kheeal Das
The National Vocational and Technical Training Com_2_15,"The National Vocational and Technical Training Commission (Amendment) Bill, 2020
[Support]",Private,2,15,Not Applicable,4,1,PTI,Rai Muhammad Murtaza Iqbal;Zille Huma;Ali Khan Jadoon;Uzma Riaz
"The Child Marriage Restraint (Amendment) Bill, 201_1_14","The Child Marriage Restraint (Amendment) Bill, 2014
[Support]",Private,1,14,Religious Affairs and Inter-faith Harmony,4,1,PML-N,Muhammad Pervaiz Malik;Shaista Pervaiz;Asiya Naz Tanoli;Marvi Memon
"The Child Marriage Restraint (Amendment) Bill, 201_1_15","The Child Marriage Restraint (Amendment) Bill, 2019
[Support]",Private,1,15,Not Applicable,4,2,PPPP;PTI,Dr. Ramesh Kumar Vankwani;Dr. Ramesh Kumar Vankwani;Shazia Marri;Shazia Marri
"The Child Protection System Bill, 2014 (Amendment _1_14","The Child Protection System Bill, 2014 (Amendment in sections 8, 10, 11 and 12)
[Support]",Private,1,14,"Law, Justice and Human Rights",4,1,PML-N,Muhammad Pervaiz Malik;Shaista Pervaiz;Asiya Naz Tanoli;Marvi Memon
"The Religious Scholars, Ulema and Pesh Imams (Pray_4_14","The Religious Scholars, Ulema and Pesh Imams (Prayers Leaders) Welfare Bill, 2017
[Support]",Private,4,14,Not Applicable,4,1,MQM,Mohammad Salman Khan Baloch;Kishwer Zehra;Mohammad Salman Khan Baloch;Kishwer Zehra
"The Representation of the People (Amendment) Bill,_1_14","The Representation of the People (Amendment) Bill, 2014 (Amendment in section 103AA)
[Support]",Private,1,14,Parliamentary Affairs,4,1,MQM,S. A. Iqbal Qadri;Sufyan Yousuf;Sajid Ahmed;Dr. Nikhat Shakeel Khan
"The Representation of the People (Amendment) Bill,_3_14","The Representation of the People (Amendment) Bill, 2016
[Support]",Private,3,14,Not Applicable,4,1,MQM,Muhammad Muzammil Qureshi;Kishwer Zehra;Saman Sultana Jafri;Dr. Nikhat Shakeel Khan
"The Riast-e-Madina Authority Bill, 2021
[Support]_4_15","The Riast-e-Madina Authority Bill, 2021
[Support]",Private,4,15,Not Applicable,4,1,PTI,Amjid Ali Khan;Amjid Ali Khan;Amjid Ali Khan;Amjid Ali Khan
"The Riast-e-Madina Authority Bill, 2022
[Support]_4_15","The Riast-e-Madina Authority Bill, 2022
[Support]",Private,4,15,Not Applicable,4,1,PTI,Amjid Ali Khan;Amjid Ali Khan;Amjid Ali Khan;Amjid Ali Khan
"The Regulation of Generation, Transmission and Dis_2_15","The Regulation of Generation, Transmission and Distribution of Electric Power (Amendment) Bill, 2020
[Support]",Private,2,15,Not Applicable,4,1,PTI,Munaza Hassan;Munaza Hassan;Munaza Hassan;Munaza Hassan
"The Prevention of Offences in Sports Bill, 2020
[S_2_15","The Prevention of Offences in Sports Bill, 2020
[Support]",Private,2,15,Not Applicable,4,1,MQM,Iqbal Muhammad Ali Khan;Iqbal Muhammad Ali Khan;Iqbal Muhammad Ali Khan;Iqbal Muhammad Ali Khan
The Prevention of Smuggling of Migrants (Amendment_4_15,"The Prevention of Smuggling of Migrants (Amendment) Bill, 2020
[Support]",Private,4,15,Not Applicable,4,1,PTI,Nafeesa Inayatullah Khan Khattak;Nafeesa Inayatullah Khan Khattak;Nafeesa Inayatullah Khan Khattak;Nafeesa Inayatullah Khan Khattak
"The Constitution (Amendment) Bill, 2017 (Amendment_5_14","The Constitution (Amendment) Bill, 2017 (Amendment in Article 51)
[Support]",Private,5,14,Not Applicable,4,1,MQM,S. A. Iqbal Qadri;Shaikh Salahuddin;Kishwer Zehra;Dr. Nikhat Shakeel Khan
"The Constitution (Amendment) Bill, 2017 (Amendment_5_14","The Constitution (Amendment) Bill, 2017 (Amendment in Article 91)
[Support]",Private,5,14,Not Applicable,4,1,JUI,Naeema Kishwar Khan;Naeema Kishwar Khan;Naeema Kishwar Khan;Naeema Kishwar Khan
"The Constitution (Amendment) Bill, 2017 (Amendment_5_14","The Constitution (Amendment) Bill, 2017 (Amendment of Article 5)
[Support]",Private,5,14,Not Applicable,4,1,MQM,Mohammad Salman Khan Baloch;Mehboob Alam;Kishwer Zehra;Dr. Fouzia Hameed
"The Constitution (Amendment) Bill, 2018 (Article 1_1_15","The Constitution (Amendment) Bill, 2018 (Article 198)
[Support]",Private,1,15,Not Applicable,4,1,MQM,Salah-ud-Din;Iqbal Muhammad Ali Khan;Kishwer Zehra;Usama Qadri
"The Constitution (Amendment) Bill, 2019 (Article 2_2_15","The Constitution (Amendment) Bill, 2019 (Article 27)
[Support]",Private,2,15,Not Applicable,4,1,MMA,Salah Ud Din Ayubi;Salah Ud Din Ayubi;Salah Ud Din Ayubi;Salah Ud Din Ayubi
The Prevention of Electronic Crimes (Amendment) Bi_4_15,"The Prevention of Electronic Crimes (Amendment) Bill, 2022
[Support]",Private,4,15,Not Applicable,4,1,PTI,Muhammad Aslam Khan;Muhammad Aslam Khan;Muhammad Aslam Khan;Muhammad Aslam Khan
The Gas (Theft Control and Recovery) (Amendment) B_5_14,"The Gas (Theft Control and Recovery) (Amendment) Bill, 2017
[Support]",Private,5,14,Not Applicable,4,1,JI,Sher Akbar Khan;Sahibzada Tariq Ullah;Sahib Zada Muhammad Yaqub;Aisha Syed
The Gas (Theft Control and Recovery) (Amendment) B_5_15,"The Gas (Theft Control and Recovery) (Amendment) Bill, 2023
[Support]",Government,5,15,Not Applicable,4,1,PML-N,Khurram Dastgir Khan;Khurram Dastgir Khan;Khurram Dastgir Khan;Khurram Dastgir Khan
"The Pakistan Psychological Council Bill, 2018
[Sup_1_15","The Pakistan Psychological Council Bill, 2018
[Support]",Private,1,15,Not Applicable,4,1,PTI,Riaz Fatyana;Riaz Fatyana;Riaz Fatyana;Riaz Fatyana
